{
  "$schema": "./catalog.schema.json",
  "schema_version": "1.1.0",
  "release_version": "0.1.0",
  "release_channel": "prerelease",
  "repository": {
    "name": "apograph",
    "url": "https://github.com/eliainnocenti/apograph",
    "description": "A curated collection of LaTeX and Typst templates for academic and professional use.",
    "maintainer": "Elia Innocenti",
    "tooling_license": "MIT"
  },
  "templates": [
    {
      "id": "thesis-polito-latex",
      "name": "PoliTo Thesis",
      "description": "Unofficial Bachelor's and Master's thesis starter aligned with published Politecnico di Torino guidance.",
      "purpose": "thesis",
      "variant": "polito",
      "format": "latex",
      "status": "draft",
      "institution": {
        "id": "polito",
        "name": "Politecnico di Torino",
        "relationship": "unofficial",
        "requirements_url": "https://didattica.polito.it/guida/2025/en/stesura_della_tesi?cds=18&sdu=37",
        "last_verified": "2026-07-18"
      },
      "compiler": "pdflatex",
      "compatibility": {
        "texlive": ["2026"],
        "overleaf": "untested"
      },
      "source_dir": "templates/thesis/polito-latex",
      "entrypoints": [
        {
          "path": "main.tex",
          "role": "starter",
          "include_in_artifact": true,
          "preview": false
        }
      ],
      "shared_deps": [
        "shared/latex/apograph-math.sty",
        "shared/latex/apograph-typography.sty",
        "shared/latex/apograph-colors.sty",
        "shared/latex/apograph-polito.sty"
      ],
      "license": {
        "expression": "CC-BY-4.0 AND MIT",
        "status": "declared",
        "notes": "The adapted thesis starter and title-page implementation retain the upstream CC BY 4.0 terms; Apograph shared modules remain MIT. The template stays draft until final human review and Overleaf verification."
      },
      "upstream": {
        "kind": "adapted",
        "sources": [
          {
            "title": "Politecnico di Torino Thesis Template",
            "url": "https://www.overleaf.com/latex/templates/politecnico-di-torino-thesis-template/cmpmxftwvvbr",
            "authors": ["Luigi De Russis"],
            "revision": "Local Overleaf reference snapshot reviewed 2026-07-18",
            "license": "CC-BY-4.0"
          }
        ],
        "notes": "Apograph adapts the upstream toptesi project into a smaller starter with isolated configuration, a Bachelor/Master metadata switch, optional user-provided logo fallback, and self-contained release packaging. Published PoliTo guidance is a formatting reference, not endorsement."
      },
      "assets": [
        {
          "id": "polito-logo",
          "description": "Politecnico di Torino logo",
          "local_path": "theme/assets/polito-logo.pdf",
          "mode": "user-provided",
          "required": false,
          "source_url": null,
          "sha256": null,
          "fallback": "latex-text-placeholder",
          "license": {
            "expression": null,
            "status": "review-required",
            "notes": "PoliTo's student guidance documents private-portal acquisition and academic use. Public redistribution and broader trademark permission for Apograph remain unproven."
          }
        }
      ],
      "tags": ["thesis", "bachelor", "master", "polito", "politecnico", "torino", "latex"],
      "maintainers": [
        {
          "name": "Elia Innocenti",
          "github": "eliainnocenti"
        }
      ],
      "readiness_notes": "Implemented as one configurable Bachelor/Master starter and compared with published thesis guidance. Both modes compile from the isolated packed artifact without a logo in TeX Live 2026. It remains draft pending final licensing review and an exact-ZIP Overleaf test.",
      "created": "2026-06-12",
      "updated": "2026-07-18"
    },
    {
      "id": "thesis-unifi-bsc-latex",
      "name": "UniFi Bachelor's Thesis",
      "description": "Draft bachelor's thesis starter for Università degli Studi di Firenze.",
      "purpose": "thesis",
      "variant": "unifi-bsc",
      "format": "latex",
      "status": "draft",
      "institution": {
        "id": "unifi",
        "name": "Università degli Studi di Firenze",
        "relationship": "unofficial",
        "requirements_url": null,
        "last_verified": null
      },
      "compiler": "pdflatex",
      "compatibility": {
        "texlive": [],
        "overleaf": "untested"
      },
      "source_dir": "templates/thesis/unifi-bsc-latex",
      "entrypoints": [
        {
          "path": "main.tex",
          "role": "starter",
          "include_in_artifact": true,
          "preview": false
        }
      ],
      "shared_deps": [
        "shared/latex/apograph-math.sty",
        "shared/latex/apograph-typography.sty",
        "shared/latex/apograph-colors.sty",
        "shared/latex/apograph-unifi.sty"
      ],
      "license": {
        "expression": "MIT",
        "status": "declared",
        "notes": "The current placeholder source is original Apograph work. Institutional formatting requirements remain unverified."
      },
      "upstream": {
        "kind": "original",
        "sources": [],
        "notes": "No external template source has been incorporated into the current draft."
      },
      "assets": [
        {
          "id": "unifi-logo",
          "description": "Università degli Studi di Firenze logo",
          "local_path": "theme/assets/unifi-logo.pdf",
          "mode": "user-provided",
          "required": false,
          "source_url": null,
          "sha256": null,
          "fallback": "latex-text-placeholder",
          "license": {
            "expression": null,
            "status": "review-required",
            "notes": "Redistribution and trademark terms require human evidence."
          }
        }
      ],
      "tags": ["thesis", "bachelor", "unifi", "firenze", "florence", "latex"],
      "maintainers": [
        {
          "name": "Elia Innocenti",
          "github": "eliainnocenti"
        }
      ],
      "readiness_notes": "Compiling skeleton only; institutional requirements, representative content, documentation, preview, and compatibility are not yet verified.",
      "created": "2026-06-12",
      "updated": "2026-07-18"
    },
    {
      "id": "presentation-beamer-academic-latex",
      "name": "Academic Beamer Presentation",
      "description": "Draft generic Beamer starter for academic talks, seminars, and conference presentations.",
      "purpose": "presentation",
      "variant": "beamer-academic",
      "format": "latex",
      "status": "draft",
      "institution": {
        "id": "generic",
        "name": "Generic / Unaffiliated",
        "relationship": "generic",
        "requirements_url": null,
        "last_verified": null
      },
      "compiler": "pdflatex",
      "compatibility": {
        "texlive": [],
        "overleaf": "untested"
      },
      "source_dir": "templates/presentation/beamer-academic-latex",
      "entrypoints": [
        {
          "path": "main.tex",
          "role": "starter",
          "include_in_artifact": true,
          "preview": false
        }
      ],
      "shared_deps": [
        "shared/latex/apograph-math.sty",
        "shared/latex/apograph-colors.sty"
      ],
      "license": {
        "expression": "MIT",
        "status": "declared",
        "notes": "The current placeholder source is original Apograph work."
      },
      "upstream": {
        "kind": "original",
        "sources": [],
        "notes": "No external template source has been incorporated into the current draft."
      },
      "assets": [],
      "tags": ["presentation", "beamer", "slides", "academic", "talk", "conference", "latex"],
      "maintainers": [
        {
          "name": "Elia Innocenti",
          "github": "eliainnocenti"
        }
      ],
      "readiness_notes": "Compiling skeleton only; theme, representative content, preview, documentation, and compatibility are not implemented.",
      "created": "2026-06-12",
      "updated": "2026-07-18"
    },
    {
      "id": "presentation-beamer-polito-latex",
      "name": "PoliTo Beamer Presentation",
      "description": "Unofficial Beamer starter and showcase for Politecnico di Torino presentations.",
      "purpose": "presentation",
      "variant": "beamer-polito",
      "format": "latex",
      "status": "beta",
      "institution": {
        "id": "polito",
        "name": "Politecnico di Torino",
        "relationship": "unofficial",
        "requirements_url": "https://www.polito.it/en/polito/about-us/corporate-image",
        "last_verified": "2026-07-18"
      },
      "compiler": "pdflatex",
      "compatibility": {
        "texlive": ["2025", "2026"],
        "overleaf": "compatible"
      },
      "source_dir": "templates/presentation/beamer-polito-latex",
      "entrypoints": [
        {
          "path": "main.tex",
          "role": "starter",
          "include_in_artifact": true,
          "preview": false
        },
        {
          "path": "showcase.tex",
          "role": "showcase",
          "include_in_artifact": true,
          "preview": true
        }
      ],
      "shared_deps": [],
      "license": {
        "expression": "GPL-3.0-or-later AND CC-BY-4.0",
        "status": "verified",
        "notes": "File-level evidence supports GPL-3.0-or-later for theme code and CC-BY-4.0 for adapted showcase content. Complete texts and attribution ship in the artifact. Maintainer Elia Innocenti reviewed and accepted the component boundary, license texts, modification log, and non-endorsement statements on 2026-07-12."
      },
      "upstream": {
        "kind": "adapted",
        "sources": [
          {
            "title": "Politecnico di Torino Presentation",
            "url": "https://www.overleaf.com/latex/templates/politecnico-di-torino-presentation/cnypkdbdyqky",
            "authors": ["Mattia Ippoliti"],